{"base_plan_sha256":"ea61158a3046db70808a81d5762e8e7dad75476fb8ef7c5647d018aad9efdd1a","based_on_review_evaluation_sha256":"552b8d2b2796ac991b71fc196bd317712439990b9c7bab1b8371682ca3353b5d","based_on_review_sha256":"84d80e326aa6341dde3a7ec4f17dafc67c8efdff8e2e460f0375865abc8a9775","from_iteration":1,"linked_elements":[],"operations":[{"element_id":"card-02","issue_id":"issue-01","path":"/geometry/y","value":0.35}],"page_id":"S01","revision_reason":"Move card-02 upward to align vertically with card-01, resolving the recoverable major layout issue and matching the Approved Design.","schema_version":"1.0","targets":["card-02"],"task_id":"p5-live-01","to_iteration":2}
